{
  "version": 2,
  "force_human_review": false,
  "prohibit_sending": false,
  "prohibit_integration_api": false,
  "prohibit_recovery_key_export": false,
  "require_external_audit_anchor": false,
  "max_daily_send_limit": 5,
  "min_cooldown_minutes": 60,
  "min_retention_days": 365,
  "allowed_models": [
    "qwen3.5:9b-q8_0",
    "granite4.2:8b-q8_0"
  ],
  "policy_id": "example-org-production",
  "revision": 1
}
